{
  "schemaVersion": 1,
  "id": "pawn-3.10.8-3.10.10-openmp-3.10.11",
  "generatedAt": "2026-07-30T20:00:00Z",
  "artifacts": [
    {
      "vendor": "pawn-lang",
      "version": "3.10.8",
      "profiles": ["legacy", "samp-037"],
      "target": "linux-amd64",
      "source": {
        "repository": "pawn-lang/compiler",
        "tag": "v3.10.8",
        "commit": "018f1f65f380701db4ce212bc18b01ac5a2d1068"
      },
      "archive": {
        "url": "https://github.com/pawn-lang/compiler/releases/download/v3.10.8/pawnc-3.10.8-linux.tar.gz",
        "format": "tar.gz",
        "size": 323221,
        "checksum": "sha256:f3a9be8455b6ee289884b246f7ef0c1b4ebebf510b33bc2be47eb41eabbf3e69"
      },
      "executable": {
        "path": "pawnc-3.10.8-linux/bin/pawncc",
        "architecture": "386",
        "checksum": "sha256:b85cc98ddd84078e0fa41beb2d1c7a3b89017dca9e8d0b20a61a0e65e3ff0470"
      }
    },
    {
      "vendor": "pawn-lang",
      "version": "3.10.8",
      "profiles": ["legacy", "samp-037"],
      "target": "windows-amd64",
      "source": {
        "repository": "pawn-lang/compiler",
        "tag": "v3.10.8",
        "commit": "018f1f65f380701db4ce212bc18b01ac5a2d1068"
      },
      "archive": {
        "url": "https://github.com/pawn-lang/compiler/releases/download/v3.10.8/pawnc-3.10.8-windows.zip",
        "format": "zip",
        "size": 109120,
        "checksum": "sha256:08e0a2c3c0d2e22c16cb02e9a27b204762f717b25d5d36aa6c989733fdeab0ec"
      },
      "executable": {
        "path": "pawnc-3.10.8-windows/bin/pawncc.exe",
        "architecture": "386",
        "checksum": "sha256:7cb4b3d70d14bf3a2244fb872fcb6cd8c099a0f32c7e3b1f2900d856136aa7ff"
      }
    },
    {
      "vendor": "pawn-lang",
      "version": "3.10.10",
      "profiles": ["legacy", "samp-037"],
      "target": "linux-amd64",
      "source": {
        "repository": "pawn-lang/compiler",
        "tag": "v3.10.10",
        "commit": "289cfeb1268f833ae1796debbab1e464306296ca"
      },
      "archive": {
        "url": "https://github.com/pawn-lang/compiler/releases/download/v3.10.10/pawnc-3.10.10-linux.tar.gz",
        "format": "tar.gz",
        "size": 336397,
        "checksum": "sha256:9bbb1df6e933318fce1fa61951e4196b70613c637a5a1d4c96937e147c18468d"
      },
      "executable": {
        "path": "pawnc-3.10.10-linux/bin/pawncc",
        "architecture": "386",
        "checksum": "sha256:189c9579c3affe7555f7743b5868cbd2094d040eb0feecce8abd4a182fe4fa00"
      }
    },
    {
      "vendor": "pawn-lang",
      "version": "3.10.10",
      "profiles": ["legacy", "samp-037"],
      "target": "windows-amd64",
      "source": {
        "repository": "pawn-lang/compiler",
        "tag": "v3.10.10",
        "commit": "289cfeb1268f833ae1796debbab1e464306296ca"
      },
      "archive": {
        "url": "https://github.com/pawn-lang/compiler/releases/download/v3.10.10/pawnc-3.10.10-windows.zip",
        "format": "zip",
        "size": 487088,
        "checksum": "sha256:14a94e93f0e05443752b9925d69f76c07db7970eaa4dfb175cde01c74451c2fe"
      },
      "executable": {
        "path": "pawnc-3.10.10-windows/bin/pawncc.exe",
        "architecture": "386",
        "checksum": "sha256:8f5445733fca6047bcda4c761528ca85a6ed44822f775a27cf699f1124292569"
      }
    },
    {
      "vendor": "openmultiplayer",
      "version": "3.10.11",
      "profiles": ["openmp", "recommended", "strict"],
      "target": "linux-amd64",
      "source": {
        "repository": "openmultiplayer/compiler",
        "tag": "v3.10.11",
        "commit": "38e9795439fff218fae5096d43c468acc2e513a1"
      },
      "archive": {
        "url": "https://github.com/openmultiplayer/compiler/releases/download/v3.10.11/pawnc-3.10.11-linux.tar.gz",
        "format": "tar.gz",
        "size": 356629,
        "checksum": "sha256:13977433acb1dfb23e3ec6354f622115d5073e97aced9395058a9db59d2564c2"
      },
      "executable": {
        "path": "pawnc-3.10.11-linux/bin/pawncc",
        "architecture": "386",
        "checksum": "sha256:a2a46eb51b0e685622624006bc2a1bcabef96d0a8bbeb01dfb5c3c3b150b4ba0"
      }
    },
    {
      "vendor": "openmultiplayer",
      "version": "3.10.11",
      "profiles": ["openmp", "recommended", "strict"],
      "target": "windows-amd64",
      "source": {
        "repository": "openmultiplayer/compiler",
        "tag": "v3.10.11",
        "commit": "38e9795439fff218fae5096d43c468acc2e513a1"
      },
      "archive": {
        "url": "https://github.com/openmultiplayer/compiler/releases/download/v3.10.11/pawnc-3.10.11-windows.zip",
        "format": "zip",
        "size": 142193,
        "checksum": "sha256:883fba1b2d0de5eef1ea4c4f9e6f50f6250e77159ab378e0658b8f4a3899d5fe"
      },
      "executable": {
        "path": "pawnc-3.10.11-windows/bin/pawncc.exe",
        "architecture": "386",
        "checksum": "sha256:0a33aa5d97b29565fe8517dd9df8e07ffceb02ecc2b395566d998a6d2032211d"
      }
    }
  ]
}
